{
  "version": "1.0",
  "generated": "2026-06-02",
  "description": "Backend manifest for forge-integration \u2014 maps all relevant smart contracts and NestJS API endpoints for the forge prototype",
  "smartContracts": [
    {
      "id": "lending-pool",
      "name": "LendingPool",
      "address": "0x6903df3E8f45497C3097A16E534787D6Fc9F58eF",
      "abiPath": "contracts/out/LendingPool.sol/LendingPool.json",
      "sourceFile": "contracts/contracts/LendingPool.sol",
      "description": "Core lending engine. All user balances are euint128 \u2014 encrypted 128-bit integers. Supports supply (shield), borrow (with LTV check or oracle), repay, liquidate, and withdraw.",
      "inherits": [
        "FheForgeBase"
      ],
      "readFunctions": [
        {
          "name": "getSupplyBalance",
          "signature": "getSupplyBalance(address)",
          "params": [
            {
              "name": "token",
              "type": "address"
            }
          ],
          "returns": "euint128",
          "fheEncrypted": true,
          "stateMutability": "payable",
          "auth": [
            "wallet"
          ]
        },
        {
          "name": "getBorrowBalance",
          "signature": "getBorrowBalance(address)",
          "params": [
            {
              "name": "token",
              "type": "address"
            }
          ],
          "returns": "euint128",
          "fheEncrypted": true,
          "stateMutability": "payable",
          "auth": [
            "wallet"
          ]
        },
        {
          "name": "isLiquidatable",
          "signature": "isLiquidatable(address,address,address,uint256,uint256)",
          "params": [
            {
              "name": "user",
              "type": "address"
            },
            {
              "name": "collateralToken",
              "type": "address"
            },
            {
              "name": "debtToken",
              "type": "address"
            },
            {
              "name": "collateralAmount",
              "type": "uint256"
            },
            {
              "name": "borrowAmount",
              "type": "uint256"
            }
          ],
          "returns": "bool",
          "fheEncrypted": false,
          "stateMutability": "view",
          "auth": [
            "public"
          ]
        },
        {
          "name": "maxFlashLoan",
          "signature": "maxFlashLoan(address)",
          "params": [
            {
              "name": "token",
              "type": "address"
            }
          ],
          "returns": "uint256",
          "fheEncrypted": false,
          "stateMutability": "view",
          "auth": [
            "public"
          ]
        },
        {
          "name": "flashFee",
          "signature": "flashFee(address,uint256)",
          "params": [
            {
              "name": "token",
              "type": "address"
            },
            {
              "name": "amount",
              "type": "uint256"
            }
          ],
          "returns": "uint256",
          "fheEncrypted": false,
          "stateMutability": "view",
          "auth": [
            "public"
          ]
        },
        {
          "name": "totalPlainBorrow",
          "signature": "totalPlainBorrow(address)",
          "params": [
            {
              "name": "token",
              "type": "address"
            }
          ],
          "returns": "uint256",
          "fheEncrypted": false,
          "stateMutability": "view",
          "auth": [
            "public"
          ]
        },
        {
          "name": "liquidReserve",
          "signature": "liquidReserve(address)",
          "params": [
            {
              "name": "token",
              "type": "address"
            }
          ],
          "returns": "uint256",
          "fheEncrypted": false,
          "stateMutability": "view",
          "auth": [
            "public"
          ]
        },
        {
          "name": "lastRevealTime",
          "signature": "lastRevealTime(address,address)",
          "params": [
            {
              "name": "",
              "type": "address"
            },
            {
              "name": "",
              "type": "address"
            }
          ],
          "returns": "uint256",
          "fheEncrypted": false,
          "stateMutability": "view",
          "auth": [
            "public"
          ]
        },
        {
          "name": "composer",
          "signature": "composer()",
          "params": [],
          "returns": "address",
          "fheEncrypted": false,
          "stateMutability": "view",
          "auth": [
            "public"
          ]
        },
        {
          "name": "oracle",
          "signature": "oracle()",
          "params": [],
          "returns": "address",
          "fheEncrypted": false,
          "stateMutability": "view",
          "auth": [
            "public"
          ]
        },
        {
          "name": "weth",
          "signature": "weth()",
          "params": [],
          "returns": "address",
          "fheEncrypted": false,
          "stateMutability": "view",
          "auth": [
            "public"
          ]
        },
        {
          "name": "owner",
          "signature": "owner()",
          "params": [],
          "returns": "address",
          "fheEncrypted": false,
          "stateMutability": "view",
          "auth": [
            "public"
          ]
        },
        {
          "name": "paused",
          "signature": "paused()",
          "params": [],
          "returns": "bool",
          "fheEncrypted": false,
          "stateMutability": "view",
          "auth": [
            "public"
          ]
        },
        {
          "name": "pendingOwner",
          "signature": "pendingOwner()",
          "params": [],
          "returns": "address",
          "fheEncrypted": false,
          "stateMutability": "view",
          "auth": [
            "public"
          ]
        }
      ],
      "writeFunctions": [
        {
          "name": "shield",
          "signature": "shield(address,uint256,InEuint128)",
          "params": [
            {
              "name": "token",
              "type": "address"
            },
            {
              "name": "amount",
              "type": "uint256"
            },
            {
              "name": "encAmount",
              "type": "InEuint128"
            }
          ],
          "fheEncrypted": true,
          "stateMutability": "payable",
          "auth": [
            "wallet"
          ],
          "description": "Supply tokens with encrypted amount. FHE.eq verification on plain vs encrypted."
        },
        {
          "name": "borrowWithLtvCheck",
          "signature": "borrowWithLtvCheck(address,address,uint256,InEuint128,uint128,uint128)",
          "params": [
            {
              "name": "collateralToken",
              "type": "address"
            },
            {
              "name": "borrowToken",
              "type": "address"
            },
            {
              "name": "borrowAmount",
              "type": "uint256"
            },
            {
              "name": "encBorrowAmount",
              "type": "InEuint128"
            },
            {
              "name": "ltvNum",
              "type": "uint128"
            },
            {
              "name": "ltvDen",
              "type": "uint128"
            }
          ],
          "returns": "euint128",
          "fheEncrypted": true,
          "stateMutability": "payable",
          "auth": [
            "wallet"
          ],
          "description": "Borrow with encrypted LTV check computed entirely on ciphertext."
        },
        {
          "name": "borrowWithOracle",
          "signature": "borrowWithOracle(address,address,uint256,uint256,InEuint128)",
          "params": [
            {
              "name": "collateralToken",
              "type": "address"
            },
            {
              "name": "borrowToken",
              "type": "address"
            },
            {
              "name": "collateralAmount",
              "type": "uint256"
            },
            {
              "name": "borrowAmount",
              "type": "uint256"
            },
            {
              "name": "encBorrowAmount",
              "type": "InEuint128"
            }
          ],
          "returns": "euint128",
          "fheEncrypted": true,
          "stateMutability": "payable",
          "auth": [
            "wallet"
          ],
          "description": "Oracle-based borrow with Pyth price health check."
        },
        {
          "name": "repayDebt",
          "signature": "repayDebt(address,uint256,InEuint128)",
          "params": [
            {
              "name": "token",
              "type": "address"
            },
            {
              "name": "amount",
              "type": "uint256"
            },
            {
              "name": "encAmount",
              "type": "InEuint128"
            }
          ],
          "fheEncrypted": true,
          "stateMutability": "payable",
          "auth": [
            "wallet"
          ],
          "description": "Repay encrypted debt amount."
        },
        {
          "name": "partialUnshield",
          "signature": "partialUnshield(address,uint256,InEuint128)",
          "params": [
            {
              "name": "token",
              "type": "address"
            },
            {
              "name": "amount",
              "type": "uint256"
            },
            {
              "name": "encAmount",
              "type": "InEuint128"
            }
          ],
          "fheEncrypted": true,
          "stateMutability": "payable",
          "auth": [
            "wallet"
          ],
          "description": "Partial withdrawal of supplied tokens."
        },
        {